{"$schema":"https://ui.shadcn.com/schema/registry-item.json","name":"c-badge-20","type":"registry:block","title":"Badge with an icon","description":"Badge with an icon","dependencies":[],"registryDependencies":["@neui/badge"],"files":[{"path":"c-badge-20.tsx","type":"registry:block","content":"import { Badge } from \"@/components/neui/badge\"\n\nimport { IconPlaceholder } from \"@/app/(create)/components/icon-placeholder\"\n\nexport function Pattern() {\n  return (\n    <Badge variant=\"outline\">\n      <IconPlaceholder\n        lucide=\"CheckIcon\"\n        tabler=\"IconCheck\"\n        hugeicons=\"Tick02Icon\"\n        phosphor=\"CheckIcon\"\n        remixicon=\"RiCheckLine\"\n      />\n      Badge\n    </Badge>\n  )\n}","target":"components/examples/c-badge-20.tsx"}],"meta":{"order":20}}