{"$schema":"https://ui.shadcn.com/schema/registry-item.json","name":"c-badge-18","type":"registry:block","title":"Badge size variations","description":"Badge size variations","dependencies":[],"registryDependencies":["@neui/badge"],"files":[{"path":"c-badge-18.tsx","type":"registry:block","content":"import { Badge } from \"@/components/neui/badge\"\n\nexport function Pattern() {\n  return (\n    <div className=\"flex items-center gap-2.5\">\n      <Badge size=\"sm\">Small</Badge>\n      <Badge size=\"default\">Default</Badge>\n      <Badge size=\"lg\">Large</Badge>\n    </div>\n  )\n}","target":"components/examples/c-badge-18.tsx"}],"meta":{"order":18}}