{"$schema":"https://ui.shadcn.com/schema/registry-item.json","name":"c-alert-19","type":"registry:block","title":"User message notification alert","description":"User message notification alert","dependencies":[],"registryDependencies":["@neui/alert","avatar","button","@neui/frame"],"files":[{"path":"c-alert-19.tsx","type":"registry:block","content":"import {\n  Alert,\n  AlertAction,\n  AlertDescription,\n  AlertTitle,\n} from \"@/components/neui/alert\"\nimport { Frame, FramePanel } from \"@/components/neui/frame\"\n\nimport {\n  Avatar,\n  AvatarFallback,\n  AvatarImage,\n} from \"@/components/ui/avatar\"\nimport { Button } from \"@/components/ui/button\"\n\nexport function Pattern() {\n  return (\n    <div className=\"mx-auto mb-auto w-full max-w-lg\">\n      <Frame>\n        <FramePanel className=\"overflow-hidden p-0!\">\n          <Alert className=\"grid-cols-[32px_1fr] gap-x-3 border-0 shadow-none\">\n            <Avatar className=\"size-8 border\">\n              <AvatarImage\n                src=\"https://images.unsplash.com/photo-1535713875002-d1d0cf377fde?w=96&h=96&dpr=2&q=80\"\n                alt=\"Alex Johnson\"\n              />\n              <AvatarFallback>AJ</AvatarFallback>\n            </Avatar>\n            <AlertTitle className=\"flex items-center gap-2\">\n              <span className=\"truncate\">Alex Johnson</span>\n              <span className=\"text-muted-foreground truncate font-normal\">\n                sent you a message\n              </span>\n            </AlertTitle>\n            <AlertAction>\n              <Button size=\"xs\" variant=\"outline\">\n                View\n              </Button>\n              <Button size=\"xs\">Reply</Button>\n            </AlertAction>\n            <AlertDescription className=\"line-clamp-1\">\n              &quot;Hey! I&apos;ve finished the draft for the new design system.\n              Let me know what you think when you have a moment.&quot;\n            </AlertDescription>\n          </Alert>\n        </FramePanel>\n      </Frame>\n    </div>\n  )\n}","target":"components/examples/c-alert-19.tsx"}],"meta":{"order":19}}