{"$schema":"https://ui.shadcn.com/schema/registry-item.json","name":"c-tooltip-6","type":"registry:block","title":"Tooltip with status badge","description":"Tooltip with status badge","dependencies":[],"registryDependencies":["@neui/badge","button","tooltip"],"files":[{"path":"c-tooltip-6.tsx","type":"registry:block","content":"import { Badge } from \"@/components/neui/badge\"\n\nimport { Button } from \"@/components/ui/button\"\nimport {\n  Tooltip,\n  TooltipContent,\n  TooltipProvider,\n  TooltipTrigger,\n} from \"@/components/ui/tooltip\"\n\nexport function Pattern() {\n  return (\n    <div className=\"flex items-center justify-center\">\n      <TooltipProvider>\n        <Tooltip>\n          <TooltipTrigger asChild>\n            <Button variant=\"outline\" className=\"w-fit\">\n              System Status\n            </Button>\n          </TooltipTrigger>\n          <TooltipContent className=\"p-2\">\n            <div className=\"flex flex-col gap-2\">\n              <div className=\"flex items-center justify-between gap-4\">\n                <span className=\"font-medium\">API</span>\n                <Badge variant=\"success\" size=\"sm\">\n                  Operational\n                </Badge>\n              </div>\n              <div className=\"flex items-center justify-between gap-4\">\n                <span className=\"font-medium\">Database</span>\n                <Badge variant=\"info\" size=\"sm\">\n                  Operational\n                </Badge>\n              </div>\n              <div className=\"flex items-center justify-between gap-4\">\n                <span className=\"font-medium\">CDN</span>\n                <Badge variant=\"warning\" size=\"sm\">\n                  Degraded\n                </Badge>\n              </div>\n              <p className=\"text-[10px] opacity-80\">Updated 2 min ago</p>\n            </div>\n          </TooltipContent>\n        </Tooltip>\n      </TooltipProvider>\n    </div>\n  )\n}","target":"components/examples/c-tooltip-6.tsx"}],"meta":{"order":6}}