{"$schema":"https://ui.shadcn.com/schema/registry-item.json","name":"c-alert-12","type":"registry:block","title":"Alert integrated within a Frame with reset borders","description":"Alert integrated within a Frame with reset borders","dependencies":[],"registryDependencies":["@neui/alert","@neui/frame"],"files":[{"path":"c-alert-12.tsx","type":"registry:block","content":"import {\n  Alert,\n  AlertDescription,\n  AlertTitle,\n} from \"@/components/neui/alert\"\nimport { Frame, FramePanel } from \"@/components/neui/frame\"\n\nimport { IconPlaceholder } from \"@/app/(create)/components/icon-placeholder\"\n\nexport function Pattern() {\n  return (\n    <div className=\"mx-auto mb-auto w-full max-w-lg\">\n      <Frame>\n        <FramePanel className=\"overflow-hidden p-0!\">\n          <Alert className=\"border-0 shadow-none\">\n            <IconPlaceholder\n              lucide=\"InfoIcon\"\n              tabler=\"IconInfoCircle\"\n              hugeicons=\"InformationCircleIcon\"\n              phosphor=\"InfoIcon\"\n              remixicon=\"RiInformationLine\"\n              className=\"text-destructive\"\n            />\n            <AlertTitle>System Update</AlertTitle>\n            <AlertDescription>\n              A new system update is available. Please restart your application\n              to apply the changes.\n            </AlertDescription>\n          </Alert>\n        </FramePanel>\n      </Frame>\n    </div>\n  )\n}","target":"components/examples/c-alert-12.tsx"}],"meta":{"order":12}}