{"$schema":"https://ui.shadcn.com/schema/registry-item.json","name":"c-collapsible-8","type":"registry:block","title":"Collapsible User profile","description":"Collapsible User profile","dependencies":[],"registryDependencies":["avatar","collapsible","@neui/frame"],"files":[{"path":"c-collapsible-8.tsx","type":"registry:block","content":"import {\n  Frame,\n  FrameHeader,\n  FramePanel,\n} from \"@/components/neui/frame\"\n\nimport {\n  Avatar,\n  AvatarFallback,\n  AvatarImage,\n} from \"@/components/ui/avatar\"\nimport {\n  Collapsible,\n  CollapsibleContent,\n  CollapsibleTrigger,\n} from \"@/components/ui/collapsible\"\nimport { IconPlaceholder } from \"@/app/(create)/components/icon-placeholder\"\n\nexport function Pattern() {\n  return (\n    <div className=\"h-54 w-full max-w-xs\">\n      <Frame stacked dense spacing=\"sm\" className=\"w-full\">\n        <Collapsible defaultOpen>\n          <CollapsibleTrigger className=\"flex w-full\">\n            <FrameHeader className=\"flex grow flex-row items-center justify-between gap-2\">\n              <div className=\"flex items-center gap-2\">\n                <Avatar className=\"relative size-5\">\n                  <AvatarImage src=\"https://github.com/shadcn.png\" alt=\"User\" />\n                  <AvatarFallback>JD</AvatarFallback>\n                </Avatar>\n                <span className=\"text-foreground text-sm font-medium\">\n                  @shadcn\n                </span>\n              </div>\n              <IconPlaceholder\n                lucide=\"ChevronRightIcon\"\n                tabler=\"IconChevronRight\"\n                hugeicons=\"ArrowRight01Icon\"\n                phosphor=\"CaretRightIcon\"\n                remixicon=\"RiArrowRightSLine\"\n                aria-hidden=\"true\"\n                className=\"text-muted-foreground size-4 transition-transform in-data-[state=open]:rotate-90\"\n              />\n            </FrameHeader>\n          </CollapsibleTrigger>\n          <CollapsibleContent>\n            <FramePanel>\n              {/* User profile information */}\n              <div className=\"space-y-2.5\">\n                {/* Last activity */}\n                <div className=\"flex items-center gap-2\">\n                  <IconPlaceholder\n                    lucide=\"MessageSquareIcon\"\n                    tabler=\"IconMessageDots\"\n                    hugeicons=\"Message02Icon\"\n                    phosphor=\"ChatIcon\"\n                    remixicon=\"RiChat4Line\"\n                    aria-hidden=\"true\"\n                    className=\"text-muted-foreground size-3.5\"\n                  />\n                  <span className=\"text-muted-foreground text-xs\">\n                    Last activity:\n                  </span>\n                  <span className=\"text-foreground text-xs font-medium\">\n                    2 hours ago\n                  </span>\n                </div>\n                {/* Online since */}\n                <div className=\"flex items-center gap-2\">\n                  <IconPlaceholder\n                    lucide=\"ClockIcon\"\n                    tabler=\"IconClock\"\n                    hugeicons=\"ClockIcon\"\n                    phosphor=\"ClockIcon\"\n                    remixicon=\"RiTimeLine\"\n                    aria-hidden=\"true\"\n                    className=\"text-muted-foreground size-3.5\"\n                  />\n                  <span className=\"text-muted-foreground text-xs\">\n                    Online since:\n                  </span>\n                  <span className=\"text-foreground text-xs font-medium\">\n                    Today, 9:00 AM\n                  </span>\n                </div>\n                {/* Location */}\n                <div className=\"flex items-center gap-2\">\n                  <IconPlaceholder\n                    lucide=\"MapPinIcon\"\n                    tabler=\"IconMapPin\"\n                    hugeicons=\"Location06Icon\"\n                    phosphor=\"MapPinIcon\"\n                    remixicon=\"RiMapPinLine\"\n                    aria-hidden=\"true\"\n                    className=\"text-muted-foreground size-3.5\"\n                  />\n                  <span className=\"text-muted-foreground text-xs\">\n                    Location:\n                  </span>\n                  <div className=\"flex items-center gap-1.5\">\n                    <span className=\"text-foreground text-xs font-medium\">\n                      Canada\n                    </span>\n                    <img\n                      src={`https://flagcdn.com/ca.svg`}\n                      alt=\"Canada\"\n                      className=\"size-4 shrink-0 rounded-full border object-cover\"\n                    />\n                  </div>\n                </div>\n              </div>\n            </FramePanel>\n          </CollapsibleContent>\n        </Collapsible>\n      </Frame>\n    </div>\n  )\n}","target":"components/examples/c-collapsible-8.tsx"}],"meta":{"order":8}}