{"$schema":"https://ui.shadcn.com/schema/registry-item.json","name":"c-phone-input-6","type":"registry:block","title":"Phone input with error state","description":"Phone input with error state","dependencies":[],"registryDependencies":["@neui/phone-input"],"files":[{"path":"c-phone-input-6.tsx","type":"registry:block","content":"import { PhoneInput } from \"@/components/neui/phone-input\"\n\nexport function Pattern() {\n  return <PhoneInput aria-invalid=\"true\" placeholder=\"Enter phone number\" />\n}","target":"components/examples/c-phone-input-6.tsx"}],"meta":{"order":6}}