{"$schema":"https://ui.shadcn.com/schema/registry-item.json","name":"c-icon-tile-3","type":"registry:block","title":"Framed icon tile","description":"Icon tile with framed surface","dependencies":[],"registryDependencies":["@neui/icon-tile"],"files":[{"path":"c-icon-tile-3.tsx","type":"registry:block","content":"import { IconTile } from \"@/components/neui/icon-tile\"\n\nimport { IconPlaceholder } from \"@/app/(create)/components/icon-placeholder\"\n\nexport function Pattern() {\n  return (\n    <div className=\"flex items-center justify-center\">\n      <IconTile variant=\"frame\" aria-hidden=\"true\">\n        <IconPlaceholder\n          lucide=\"LayoutDashboardIcon\"\n          tabler=\"IconLayoutDashboard\"\n          hugeicons=\"DashboardSquare02Icon\"\n          phosphor=\"LayoutIcon\"\n          remixicon=\"RiDashboardLine\"\n        />\n      </IconTile>\n    </div>\n  )\n}","target":"components/examples/c-icon-tile-3.tsx"}],"meta":{"order":3,"gridSize":2}}