{"$schema":"https://ui.shadcn.com/schema/registry-item.json","name":"c-rating-5","type":"registry:block","title":"Rating with size.","description":"Rating with size.","dependencies":[],"registryDependencies":["@neui/rating"],"files":[{"path":"c-rating-5.tsx","type":"registry:block","content":"import { Rating } from \"@/components/neui/rating\"\n\nexport function Pattern() {\n  return (\n    <div className=\"flex flex-col items-center gap-4\">\n      <Rating rating={4} size=\"sm\" />\n      <Rating rating={4} />\n      <Rating rating={4} size=\"lg\" />\n    </div>\n  )\n}","target":"components/examples/c-rating-5.tsx"}],"meta":{"order":5}}