{"$schema":"https://ui.shadcn.com/schema/registry-item.json","name":"c-button-group-41","type":"registry:block","title":"Model selector with tier badges","description":"Model selector with tier badges","dependencies":[],"registryDependencies":["@neui/badge","button","button-group","tooltip"],"files":[{"path":"c-button-group-41.tsx","type":"registry:block","content":"\"use client\"\n\nimport { useState } from \"react\"\nimport { Badge } from \"@/components/neui/badge\"\n\nimport { cn } from \"@/lib/utils\"\nimport { Button } from \"@/components/ui/button\"\nimport { ButtonGroup } from \"@/components/ui/button-group\"\nimport {\n  Tooltip,\n  TooltipContent,\n  TooltipTrigger,\n} from \"@/components/ui/tooltip\"\nimport { IconPlaceholder } from \"@/app/(create)/components/icon-placeholder\"\n\nconst models = [\n  {\n    id: \"gpt4o\",\n    label: \"GPT-4o\",\n    badge: \"Fast\",\n    badgeVariant: \"success-light\" as const,\n    tooltip: \"128k context, fastest response\",\n    icon: (\n      <IconPlaceholder\n        lucide=\"ZapIcon\"\n        tabler=\"IconBolt\"\n        hugeicons=\"LightningIcon\"\n        phosphor=\"LightningIcon\"\n        remixicon=\"RiFlashlightLine\"\n        aria-hidden=\"true\"\n      />\n    ),\n  },\n  {\n    id: \"claude\",\n    label: \"Claude\",\n    badge: \"Pro\",\n    badgeVariant: \"info-light\" as const,\n    tooltip: \"200k context, best for analysis\",\n    icon: (\n      <IconPlaceholder\n        lucide=\"BrainIcon\"\n        tabler=\"IconBrain\"\n        hugeicons=\"AiBrain01Icon\"\n        phosphor=\"BrainIcon\"\n        remixicon=\"RiBrainLine\"\n        aria-hidden=\"true\"\n      />\n    ),\n  },\n  {\n    id: \"gemini\",\n    label: \"Gemini\",\n    badge: \"Preview\",\n    badgeVariant: \"warning-light\" as const,\n    tooltip: \"1M context, experimental\",\n    icon: (\n      <IconPlaceholder\n        lucide=\"FlaskConicalIcon\"\n        tabler=\"IconFlask\"\n        hugeicons=\"ExperimentIcon\"\n        phosphor=\"FlaskIcon\"\n        remixicon=\"RiFlaskLine\"\n        aria-hidden=\"true\"\n      />\n    ),\n  },\n]\n\nexport function Pattern() {\n  const [active, setActive] = useState(\"claude\")\n\n  return (\n    <ButtonGroup>\n      {models.map((model) => (\n        <Tooltip key={model.id}>\n          <TooltipTrigger\n            render={\n              <Button\n                variant=\"outline\"\n                className={cn(active === model.id ? \"bg-muted\" : \"\")}\n                onClick={() => setActive(model.id)}\n              >\n                {model.icon}\n                {model.label}\n                <Badge variant={model.badgeVariant} size=\"xs\">\n                  {model.badge}\n                </Badge>\n              </Button>\n            }\n          />\n          <TooltipContent>{model.tooltip}</TooltipContent>\n        </Tooltip>\n      ))}\n    </ButtonGroup>\n  )\n}","target":"components/examples/c-button-group-41.tsx"}],"meta":{"order":41}}