{"$schema":"https://ui.shadcn.com/schema/registry-item.json","name":"c-frame-13","type":"registry:block","title":"Frame with small border radius","description":"Frame with small border radius","dependencies":[],"registryDependencies":["@neui/frame"],"files":[{"path":"c-frame-13.tsx","type":"registry:block","content":"import {\n  Frame,\n  FrameDescription,\n  FrameFooter,\n  FrameHeader,\n  FramePanel,\n  FrameTitle,\n} from \"@/components/neui/frame\"\n\nexport function Pattern() {\n  return (\n    <Frame className=\"w-full max-w-sm [--frame-radius:var(--radius-sm)]\">\n      <FrameHeader>\n        <FrameTitle>Network Diagnostics</FrameTitle>\n        <FrameDescription>\n          Analyzing real-time socket connections\n        </FrameDescription>\n      </FrameHeader>\n      <FramePanel>\n        <h2 className=\"text-sm font-semibold\">Port Status</h2>\n        <p className=\"text-muted-foreground text-sm\">\n          Small radius gives a sharp, precise look, perfect for technical\n          dashboards and data grids.\n        </p>\n      </FramePanel>\n      <FrameFooter>\n        <p className=\"text-muted-foreground text-sm\">Scan completed</p>\n      </FrameFooter>\n    </Frame>\n  )\n}","target":"components/examples/c-frame-13.tsx"}],"meta":{"order":13}}