{"$schema":"https://ui.shadcn.com/schema/registry-item.json","name":"c-frame-6","type":"registry:block","title":"Frame with ghost(no outer border) variant","description":"Frame with ghost(no outer border) variant","dependencies":[],"registryDependencies":["@neui/frame"],"files":[{"path":"c-frame-6.tsx","type":"registry:block","content":"import {\n  Frame,\n  FrameDescription,\n  FrameHeader,\n  FramePanel,\n  FrameTitle,\n} from \"@/components/neui/frame\"\n\nexport function Pattern() {\n  return (\n    <Frame className=\"w-full\" variant=\"ghost\">\n      <FrameHeader>\n        <FrameTitle>No Outer Border</FrameTitle>\n        <FrameDescription>\n          This frame uses variant=\"ghost\" to remove the outer border.\n        </FrameDescription>\n      </FrameHeader>\n      <FramePanel>\n        <p className=\"text-muted-foreground text-sm\">\n          The outer container of this frame has no border, only the background\n          and panels are visible.\n        </p>\n      </FramePanel>\n    </Frame>\n  )\n}","target":"components/examples/c-frame-6.tsx"}],"meta":{"order":6}}